{"$schema":"https://json-schema.org/draft/2020-12/schema","type":"array","items":{"type":"object","required":["slug","title","discipline","date","summary","role","status","publicPermission","featured","image","liveUrl","cta","outcome","proofs"],"properties":{"slug":{"type":"string"},"title":{"type":"string"},"discipline":{"type":"string"},"date":{"type":"string"},"summary":{"type":"string"},"role":{"type":"string"},"status":{"enum":["draft","published","archived"]},"publicPermission":{"type":"boolean"},"featured":{"type":"boolean"},"image":{"type":["string","null"]},"liveUrl":{"type":"string"},"cta":{"type":"string"},"outcome":{"type":"string"},"proofs":{"type":"array","minItems":1}},"additionalProperties":false}}

